{
  "spec": {
    "series": "I-1",
    "spec_version": "1.0.0-rc.4",
    "bench_version": "1.0.0rc4"
  },
  "job": {
    "requests": 256,
    "prompt_tokens": 512,
    "generated_tokens": 256,
    "generated_tokens_per_job": 65536,
    "concurrency": 32,
    "sampling": {
      "temperature": 0.0,
      "top_p": 1.0,
      "seed": 0,
      "max_tokens": 256,
      "min_tokens": 256,
      "ignore_eos": true
    }
  },
  "engine": {
    "name": "vllm",
    "version": "0.30.0",
    "model_id": "RedHatAI/Meta-Llama-3.1-8B-Instruct-quantized.w8a8",
    "model_revision": "024e24cbe4153670f747383ea3265d0fb197c727",
    "launch_mode": "subprocess",
    "launch_args": [
      "/usr/local/bin/vllm",
      "serve",
      "RedHatAI/Meta-Llama-3.1-8B-Instruct-quantized.w8a8",
      "--dtype",
      "auto",
      "--max-model-len",
      "1024",
      "--max-num-seqs",
      "32",
      "--no-enable-prefix-caching",
      "--seed",
      "0",
      "--gpu-memory-utilization",
      "0.90",
      "--port",
      "8000",
      "--host",
      "0.0.0.0",
      "--revision",
      "024e24cbe4153670f747383ea3265d0fb197c727"
    ],
    "server_url": "http://127.0.0.1:8000",
    "certified_engine": true,
    "extra": {
      "served_model": "RedHatAI/Meta-Llama-3.1-8B-Instruct-quantized.w8a8"
    }
  },
  "hardware": {
    "gpus": [
      {
        "name": "NVIDIA GeForce RTX 3090",
        "vram_mib": 24576,
        "driver_version": "570.211.01",
        "pcie_gen": 1,
        "pcie_width": 8,
        "power_limit_w": 350.0,
        "uuid": "GPU-80d7f82a-c4ea-0ee0-0d23-b3947a9139af",
        "compute_capability": "8.6"
      }
    ],
    "cuda_version": "12.8",
    "cpu_model": "11th Gen Intel(R) Core(TM) i7-11700F @ 2.50GHz",
    "cpu_cores_physical": 8,
    "cpu_threads": 16,
    "ram_gib": 62.5,
    "os": "Linux 6.5.0-44-generic",
    "platform": "Linux-6.5.0-44-generic-x86_64-with-glibc2.39",
    "python": "3.12.3",
    "kwh_bench": "1.0.0rc4",
    "hostname_hash": "b2f657ccd64841f3"
  },
  "preflight": {
    "available": true,
    "seconds": 5.0,
    "samples": 10,
    "idle": true,
    "reasons": [],
    "mem_total_mib": 24576,
    "mem_used_mib_max": 1,
    "free_fraction_min": 1.0,
    "util_pct_mean": 0.0,
    "util_pct_max": 0.0,
    "power_w_mean": 28.5,
    "thresholds": {
      "max_util_pct": 5.0,
      "min_free_fraction": 0.95
    }
  },
  "warmup": {
    "job_seconds": 45.2942,
    "generated_tokens": 65536,
    "tokens_per_second": 1446.9,
    "request_failures": 0,
    "ttft_p50_s": 0.52655,
    "ttft_p95_s": 1.15584,
    "tpot_p50_s": 0.01999,
    "tpot_p95_s": 0.02125
  },
  "runs": [
    {
      "job_seconds": 45.5623,
      "generated_tokens": 65536,
      "tokens_per_second": 1438.38,
      "request_failures": 0,
      "ttft_p50_s": 0.56906,
      "ttft_p95_s": 1.01801,
      "tpot_p50_s": 0.02,
      "tpot_p95_s": 0.0214
    },
    {
      "job_seconds": 45.9847,
      "generated_tokens": 65536,
      "tokens_per_second": 1425.17,
      "request_failures": 0,
      "ttft_p50_s": 0.54683,
      "ttft_p95_s": 1.01015,
      "tpot_p50_s": 0.02033,
      "tpot_p95_s": 0.02163
    },
    {
      "job_seconds": 46.4792,
      "generated_tokens": 65536,
      "tokens_per_second": 1410.01,
      "request_failures": 0,
      "ttft_p50_s": 0.58736,
      "ttft_p95_s": 1.07574,
      "tpot_p50_s": 0.02038,
      "tpot_p95_s": 0.02192
    }
  ],
  "score": {
    "median_job_seconds": 45.9847,
    "min_job_seconds": 45.5623,
    "max_job_seconds": 46.4792,
    "stability": 0.01994,
    "units_per_hour": 78.287,
    "mean_power_watts": 347.3,
    "units_per_electric_kwh": 225.42
  },
  "canary": {
    "passed": true,
    "passing": 8,
    "required": 6,
    "max_delta": 0.05,
    "results": [
      {
        "prompt_id": 16,
        "mean_logprob": -1.16552,
        "reference_mean_logprob": -1.16552,
        "delta": 0.0,
        "pass": true
      },
      {
        "prompt_id": 48,
        "mean_logprob": -1.11244,
        "reference_mean_logprob": -1.11244,
        "delta": 0.0,
        "pass": true
      },
      {
        "prompt_id": 80,
        "mean_logprob": -1.34789,
        "reference_mean_logprob": -1.34789,
        "delta": 0.0,
        "pass": true
      },
      {
        "prompt_id": 112,
        "mean_logprob": -1.24528,
        "reference_mean_logprob": -1.24528,
        "delta": 0.0,
        "pass": true
      },
      {
        "prompt_id": 144,
        "mean_logprob": -1.16678,
        "reference_mean_logprob": -1.16678,
        "delta": 0.0,
        "pass": true
      },
      {
        "prompt_id": 176,
        "mean_logprob": -1.17662,
        "reference_mean_logprob": -1.17662,
        "delta": 0.0,
        "pass": true
      },
      {
        "prompt_id": 208,
        "mean_logprob": -1.5939,
        "reference_mean_logprob": -1.5939,
        "delta": 0.0,
        "pass": true
      },
      {
        "prompt_id": 240,
        "mean_logprob": -1.60078,
        "reference_mean_logprob": -1.60078,
        "delta": 0.0,
        "pass": true
      }
    ]
  },
  "power": {
    "available": true,
    "samples": 136,
    "mean_watts": 347.3,
    "energy_wh": 13.308
  },
  "certified": true,
  "certified_reasons": [],
  "prompt_set_sha256": "b7ba17276b1f7346dd30db000416bae68c34c23757045ded93b31ff86303c534",
  "lock_sha256": "bb601596a03798d9eca09c88ff8a0a3fbe21c2ad6b8b4105cd9e93f511f7d0c5",
  "started_at": "2026-09-30T10:26:37Z",
  "finished_at": "2026-09-30T10:35:17Z",
  "report_sha256": "de63683a3631bd2094fbd025365e32292db2cf7cff45b5d7f6bac4749ad7cb51",
  "signature": {
    "alg": "ed25519",
    "public_key": "14af7aa3d5cd2ab1ab78e3d215b5ab154efe78e9f46e44a369e1496a33da16c8",
    "signed": "report_sha256",
    "sig": "yMT+Rl9Tm9+N1VbuctrNNM+wTkPKDEuZ5MMNe4vI+HxUwuAdjUQmrHm61OKjVe3R+ENIyc7HcL8tVMB5GfZvBw=="
  }
}
