{
  "spec": {
    "series": "I-1",
    "spec_version": "1.0.0-rc.2",
    "bench_version": "1.0.0rc2"
  },
  "job": {
    "requests": 256,
    "prompt_tokens": 512,
    "generated_tokens": 256,
    "generated_tokens_per_job": 65536,
    "concurrency": 32,
    "sampling": {
      "temperature": 0.0,
      "top_p": 1.0,
      "seed": 0,
      "max_tokens": 256,
      "min_tokens": 256,
      "ignore_eos": true
    }
  },
  "engine": {
    "name": "mock",
    "version": "0",
    "model_id": "RedHatAI/Meta-Llama-3.1-8B-Instruct-quantized.w8a8",
    "model_revision": null,
    "launch_mode": "inprocess",
    "launch_args": [
      "step_ms=0.5",
      "prefill_ms_per_1k=2.0"
    ],
    "server_url": null,
    "certified_engine": false,
    "extra": {}
  },
  "hardware": {
    "gpus": [],
    "cuda_version": null,
    "cpu_model": "Intel(R) Xeon(R) Processor @ 2.80GHz",
    "cpu_cores_physical": 2,
    "cpu_threads": 2,
    "ram_gib": 7.8,
    "os": "Linux 6.18.44-fc-v37",
    "platform": "Linux-6.18.44-fc-v37-x86_64-with-glibc2.39",
    "python": "3.11.15",
    "kwh_bench": "1.0.0rc2",
    "hostname_hash": "5bce98f73f3ed0c8"
  },
  "warmup": {
    "job_seconds": 2.8966,
    "generated_tokens": 65536,
    "tokens_per_second": 22625.15,
    "request_failures": 0,
    "ttft_p50_s": 0.00306,
    "ttft_p95_s": 0.00385,
    "tpot_p50_s": 0.0014,
    "tpot_p95_s": 0.00147
  },
  "runs": [
    {
      "job_seconds": 2.903,
      "generated_tokens": 65536,
      "tokens_per_second": 22575.27,
      "request_failures": 0,
      "ttft_p50_s": 0.00309,
      "ttft_p95_s": 0.0045,
      "tpot_p50_s": 0.00141,
      "tpot_p95_s": 0.00147
    },
    {
      "job_seconds": 2.8427,
      "generated_tokens": 65536,
      "tokens_per_second": 23054.14,
      "request_failures": 0,
      "ttft_p50_s": 0.00301,
      "ttft_p95_s": 0.00356,
      "tpot_p50_s": 0.00137,
      "tpot_p95_s": 0.00145
    },
    {
      "job_seconds": 2.8332,
      "generated_tokens": 65536,
      "tokens_per_second": 23131.44,
      "request_failures": 0,
      "ttft_p50_s": 0.003,
      "ttft_p95_s": 0.00326,
      "tpot_p50_s": 0.00136,
      "tpot_p95_s": 0.00143
    }
  ],
  "score": {
    "median_job_seconds": 2.8427,
    "min_job_seconds": 2.8332,
    "max_job_seconds": 2.903,
    "stability": 0.02455,
    "units_per_hour": 1266.402,
    "mean_power_watts": null,
    "units_per_electric_kwh": null
  },
  "canary": null,
  "power": {
    "available": false,
    "samples": 0,
    "mean_watts": null,
    "energy_wh": null
  },
  "certified": false,
  "certified_reasons": [
    "unlocked: reference/lock.json is incomplete (spec is a release candidate)",
    "mock engine performs no inference"
  ],
  "prompt_set_sha256": "b7ba17276b1f7346dd30db000416bae68c34c23757045ded93b31ff86303c534",
  "lock_sha256": null,
  "started_at": "2026-09-26T06:58:09Z",
  "finished_at": "2026-09-26T06:58:20Z",
  "report_sha256": "3cb3da024fb03c47e78972bdcf9eb9e380d6eaed000f710c76152604bb07235e",
  "signature": null
}
